{
  "finding_id": "GOLD-P0-CONFLICT-001",
  "task_id": "P0-CONFLICT-001",
  "finding_type": "structural_anomaly",
  "claim_level": "L3",
  "anomaly_codes": ["A01", "A07"],
  "claim": "The injected statement is contradicted by the official table: it says the rate fell from 62% to 55%, while the table reports an increase from 62% to 65%.",
  "company_id": "US1912161007",
  "company": "The Coca-Cola Company",
  "periods": ["FY2024", "FY2023"],
  "metric": {"name": "Packaging collection rate", "reported_value": "Official FY2024: 65; injected FY2024: 55", "unit": "%", "subject": "The Coca-Cola system", "boundary": "Equivalent bottles and cans introduced into the market", "period": "FY2024"},
  "supporting_evidence": [{"document_id": "KO-EU-2024", "document_sha256": "c71a25d345a5b3c5342cce74d63ae9d3e436d9c91e5370ce44014970543c7ec9", "page": 10, "printed_page": "10", "location": "Packaging Update table, collection-rate row", "excerpt": "2022 61%; 2023 62%; 2024 65%.", "evidence_strength": "direct", "transformation": null}],
  "contrary_evidence": [{"document_id": "P0-CI-001", "document_sha256": "c0e99716000df1a0dd049d10acbb9d4986cd38ba893df2b53a4dfa3d6c69dd9b", "page": 1, "printed_page": null, "location": "injected_text field", "excerpt": "In 2024 ... collection rate ... declined from 62% to 55%.", "evidence_strength": "direct", "transformation": "Researcher-created intervention; not a company statement."}],
  "calculation": null,
  "rule_checks": [{"rule_id": "SAME_METRIC_PERIOD_BOUNDARY_CONFLICT", "result": "fail", "details": "The FY2024 values differ by 10 percentage points and the direction also conflicts."}],
  "search_scope": {"checked_elements": ["tables"], "completeness": "complete", "limitations": ["Conflict is deliberately injected for testing and is not evidence about company disclosure quality."]},
  "alternative_explanations": [],
  "confidence": 1.0,
  "confidence_basis": "The official and injected values refer to the same metric, period and boundary.",
  "status": "verified",
  "requires_human_review": false,
  "falsification_condition": "If the official FY2024 value were 55% under the same boundary, the conflict would disappear.",
  "provenance": {"annotation_source": "human", "framework_version": "FC-1.0", "model_snapshot": null, "prompt_sha256": null, "run_id": "p0-gold-v0.1", "created_at": "2026-09-01T00:00:00Z"}
}
